TIMU,CHAODAI,ZUOZHE,NEIRONG,YIWEN,ZZJIANJIE
菩萨蛮·平林漠漠烟如织,唐代,李白,平林漠漠烟如织，寒山一带伤心碧。#暝色入高楼，有人楼上愁。#玉阶空伫立，宿鸟归飞急。#何处是归程？#长亭连短亭。,远处舒展的树林烟雾漾潆，好像纺织物一般，秋寒的山色宛如衣带，触目伤心的碧绿。暮色进了高高的闺楼，有人正在楼上独自忧愁。玉石的台阶上，徒然侍立盼望。那回巢的鸟儿，在归心催促下急急飞翔。哪里是我返回的路程？过了长亭接着短亭。,李白（701年－762年），字太白，号青莲居士，唐朝浪漫主义诗人，被后人誉为“诗仙”。祖籍陇西成纪(待考)，出生于西域碎叶城，4岁再随父迁至剑南道绵州。李白存世诗文千余篇，有《李太白集》传世。762年病逝，享年61岁。其墓在今安徽当涂，四川江油、湖北安陆有纪念馆。
忆秦娥·箫声咽,唐代,李白,箫声咽，秦娥梦断秦楼月。#秦楼月，年年柳色，灞陵伤别。#乐游原上清秋节，咸阳古道音尘绝。#音尘绝，西风残照，汉家陵阙。,玉箫的声音悲凉呜咽，秦娥从梦中惊醒时，秦家的楼上正挂着一弦明月。秦家楼上的下弦月，每一年桥边青青的柳色，都印染着灞陵桥上的凄怆离别。遥望乐游原上冷落凄凉的秋日佳节，通往咸阳的古路上音信早已断绝。西风轻拂着夕阳的光照，眼前只是汉朝留下的坟墓和宫阙。,李白（701年－762年），字太白，号青莲居士，唐朝浪漫主义诗人，被后人誉为“诗仙”。祖籍陇西成纪(待考)，出生于西域碎叶城，4岁再随父迁至剑南道绵州。李白存世诗文千余篇，有《李太白集》传世。762年病逝，享年61岁。其墓在今安徽当涂，四川江油、湖北安陆有纪念馆。
三五七言/秋风词,唐代,李白,秋风清，秋月明，落叶聚还散，寒鸦栖复惊。#相思相见知何日？#此时此夜难为情！#入我相思门，知我相思苦，长相思兮长相忆，短相思兮无穷极，早知如此绊人心，何如当初莫相识。,秋风凌清，秋月明朗。风中的落叶时聚时散，寒鸦本已栖息，又被明月惊起。朋友盼着相见，却不知在何日，这个时节，这样的夜晚，相思梦难成。走入相思之门，知道相思之苦，永远的相思永远的回忆，短暂的相思却也无止境，早知相思如此的在心中牵绊，不如当初就不要相识。,李白（701年－762年），字太白，号青莲居士，唐朝浪漫主义诗人，被后人誉为“诗仙”。祖籍陇西成纪(待考)，出生于西域碎叶城，4岁再随父迁至剑南道绵州。李白存世诗文千余篇，有《李太白集》传世。762年病逝，享年61岁。其墓在今安徽当涂，四川江油、湖北安陆有纪念馆。
渔歌子·西塞山前白鹭飞,唐代,张志和,西塞山前白鹭飞，桃花流水鳜鱼肥。#青箬笠，绿蓑衣，斜风细雨不须归。,西塞山前白鹭在自由地翱翔，江水中，肥美的鳜鱼欢快地游着，漂浮在水中的桃花是那样的鲜艳而饱满。江岸一位老翁戴着青色的箬笠，披着绿色的蓑衣，冒着斜风细雨，悠然自得地垂钓，他被美丽的春景迷住了，连下了雨都不回家。,张志和（730年(庚午年)～810年？），字子同，初名龟龄，汉族，婺州（今浙江金华）人，自号“烟波钓徒”，又号“玄真子”。唐代著名道士、词人和诗人。十六岁参加科举，以明经擢第，授左金吾卫录事参军，唐肃宗赐名为“志和”。因事获罪贬南浦尉，不久赦还。自此看破红尘，浪迹江湖，隐居祁门赤山镇。其兄张鹤龄担心他遁世不归，在越州（今绍兴市）城东筑茅屋让他居住。史载唐肃宗曾赐他奴婢各一人，张志和让他们结婚，取名渔童和樵青。著有《玄真子》集。
调笑令·边草,唐代,戴叔伦,边草，边草，边草尽来兵老。#山南山北雪晴，千里万里月明。#明月，明月，胡笳一声愁绝。,边塞的野草啊，边塞的野草！野草枯尽时。戍边的兵士已老。山南山北雪后放睛，千里万里处处月明。明月啊，明月！远处传来胡笳一声，令人肠断欲绝。,戴叔伦(732—789)，唐代诗人，字幼公（一作次公），润州金坛(今属江苏)人。年轻时师事萧颖士。曾任新城令、东阳令、抚州刺史、容管经略使。晚年上表自请为道士。其诗多表现隐逸生活和闲适情调，但《女耕田行》、《屯田词》等篇也反映了人民生活的艰苦。论诗主张“诗家之景，如蓝田日暖，良玉生烟，可望而不可置于眉睫之前”。其诗体裁皆有所涉猎。
宫中调笑·团扇,唐代,王建,团扇，团扇，美人病来遮面。#玉颜憔悴三年，谁复商量管弦。#弦管，弦管，春草昭阳路断。,团扇，团扇，宫中的美人病后用它来遮面。抱病三年，容颜憔悴，再没有谁同她商量管弦！管弦，管弦，无情的春草把通往昭阳殿的道路阻断。,王建(约767年—约830年)：字仲初，生于颍川(今河南许昌)，唐朝诗人。其著作，《新唐书&183;艺文志》、《郡斋读书志》、《直斋书录解题》等皆作10卷，《崇文总目》作2卷。
竹枝词·山桃红花满上头,唐代,刘禹锡,山桃红花满上头，蜀江春水拍山流。#花红易衰似郎意，水流无限似侬愁。,春天，山上的野桃花红艳艳的开的正旺，蜀江的江水拍着旁边的悬崖峭壁。一位姑娘看见了，认为丈夫的喜爱如同这桃花转瞬即逝，而无限的忧愁就如这源源不断的江水。,刘禹锡（772－842），字梦得，汉族，中国唐朝彭城（今徐州）人，祖籍洛阳，唐朝文学家，哲学家，自称是汉中山靖王后裔，曾任监察御史，是王叔文政治改革集团的一员。唐代中晚期著名诗人，有“诗豪”之称。他的家庭是一个世代以儒学相传的书香门第。政治上主张革新，是王叔文派政治革新活动的中心人物之一。后来永贞革新失败被贬为朗州司马（今湖南常德）。据湖南常德历史学家、收藏家周新国先生考证刘禹锡被贬为朗州司马其间写了著名的“汉寿城春望”。
潇湘神·斑竹枝,唐代,刘禹锡,斑竹枝，斑竹枝，泪痕点点寄相思。#楚客欲听瑶瑟怨，潇湘深夜月明时。,斑竹枝啊斑竹枝，泪痕点点寄托着相思。楚地的游子啊若想听听瑶瑟的幽怨，在这潇水湘江之上当着夜深月明之时。,刘禹锡（772－842），字梦得，汉族，中国唐朝彭城（今徐州）人，祖籍洛阳，唐朝文学家，哲学家，自称是汉中山靖王后裔，曾任监察御史，是王叔文政治改革集团的一员。唐代中晚期著名诗人，有“诗豪”之称。他的家庭是一个世代以儒学相传的书香门第。政治上主张革新，是王叔文派政治革新活动的中心人物之一。后来永贞革新失败被贬为朗州司马（今湖南常德）。据湖南常德历史学家、收藏家周新国先生考证刘禹锡被贬为朗州司马其间写了著名的“汉寿城春望”。
忆江南·江南好,唐代,白居易,江南好，风景旧曾谙。#日出江花红胜火，春来江水绿如蓝。#能不忆江南？,江南的风景多么美好，如画的风景久已熟悉。春天到来时，太阳从江面升起，把江边的鲜花照得比火红，碧绿的江水绿得胜过蓝草。怎能叫人不怀念江南？,白居易（772年－846年），字乐天，号香山居士，又号醉吟先生，祖籍太原，到其曾祖父时迁居下邽，生于河南新郑。是唐代伟大的现实主义诗人，唐代三大诗人之一。白居易与元稹共同倡导新乐府运动，世称“元白”，与刘禹锡并称“刘白”。白居易的诗歌题材广泛，形式多样，语言平易通俗，有“诗魔”和“诗王”之称。官至翰林学士、左赞善大夫。公元846年，白居易在洛阳逝世，葬于香山。有《白氏长庆集》传世，代表诗作有《长恨歌》、《卖炭翁》、《琵琶行》等。
忆江南词三首,唐代,白居易,江南好，风景旧曾谙。#日出江花红胜火，春来江水绿如蓝。#能不忆江南？#江南忆，最忆是杭州。#山寺月中寻桂子，郡亭枕上看潮头。#何日更重游！#江南忆，其次忆吴宫。#吴酒一杯春竹叶，吴娃双舞醉芙蓉。#早晚复相逢！,江南的风景多么美好，如画的风景久已熟悉。春天到来时，太阳从江面升起，把江边的鲜花照得比火红，碧绿的江水绿得胜过蓝草。怎能叫人不怀念江南？,白居易（772年－846年），字乐天，号香山居士，又号醉吟先生，祖籍太原，到其曾祖父时迁居下邽，生于河南新郑。是唐代伟大的现实主义诗人，唐代三大诗人之一。白居易与元稹共同倡导新乐府运动，世称“元白”，与刘禹锡并称“刘白”。白居易的诗歌题材广泛，形式多样，语言平易通俗，有“诗魔”和“诗王”之称。官至翰林学士、左赞善大夫。公元846年，白居易在洛阳逝世，葬于香山。有《白氏长庆集》传世，代表诗作有《长恨歌》、《卖炭翁》、《琵琶行》等。
长相思·汴水流,唐代,白居易,汴水流，泗水流，流到瓜州古渡头。#吴山点点愁。#思悠悠，恨悠悠，恨到归时方始休。#月明人倚楼。,汴水长流，泗水长流，流到长江古老的渡口，遥望去，江南的群山在默默点头，频频含羞，凝聚着无限哀愁。思念呀，怨恨呀，哪儿是尽头，伊人呀，除非你归来才会罢休。一轮皓月当空照，让我俩紧紧偎傍，倚楼望月。,白居易（772年－846年），字乐天，号香山居士，又号醉吟先生，祖籍太原，到其曾祖父时迁居下邽，生于河南新郑。是唐代伟大的现实主义诗人，唐代三大诗人之一。白居易与元稹共同倡导新乐府运动，世称“元白”，与刘禹锡并称“刘白”。白居易的诗歌题材广泛，形式多样，语言平易通俗，有“诗魔”和“诗王”之称。官至翰林学士、左赞善大夫。公元846年，白居易在洛阳逝世，葬于香山。有《白氏长庆集》传世，代表诗作有《长恨歌》、《卖炭翁》、《琵琶行》等。
花非花,唐代,白居易,花非花，雾非雾。#夜半来，天明去。#来如春梦几多时？#去似朝云无觅处。,说它是花不是花，说它是雾吗不是雾。半夜时到来，天明时离去。来时仿佛短暂而美好的春梦？离去时又像清晨的云彩无处寻觅。,白居易（772年－846年），字乐天，号香山居士，又号醉吟先生，祖籍太原，到其曾祖父时迁居下邽，生于河南新郑。是唐代伟大的现实主义诗人，唐代三大诗人之一。白居易与元稹共同倡导新乐府运动，世称“元白”，与刘禹锡并称“刘白”。白居易的诗歌题材广泛，形式多样，语言平易通俗，有“诗魔”和“诗王”之称。官至翰林学士、左赞善大夫。公元846年，白居易在洛阳逝世，葬于香山。有《白氏长庆集》传世，代表诗作有《长恨歌》、《卖炭翁》、《琵琶行》等。
浪淘沙·借问江潮与海水,唐代,白居易,借问江潮与海水，何似君情与妾心？#相恨不如潮有信，相思始觉海非深。,我问这江潮和海水，哪里像郎君的深情和女子的心意。男女互相埋怨的时候认为对方不如潮水守时有信，互相思念的时候才发觉海并不算深。,白居易（772年－846年），字乐天，号香山居士，又号醉吟先生，祖籍太原，到其曾祖父时迁居下邽，生于河南新郑。是唐代伟大的现实主义诗人，唐代三大诗人之一。白居易与元稹共同倡导新乐府运动，世称“元白”，与刘禹锡并称“刘白”。白居易的诗歌题材广泛，形式多样，语言平易通俗，有“诗魔”和“诗王”之称。官至翰林学士、左赞善大夫。公元846年，白居易在洛阳逝世，葬于香山。有《白氏长庆集》传世，代表诗作有《长恨歌》、《卖炭翁》、《琵琶行》等。
采莲子·菡萏香莲十顷陂,唐代,皇甫松,菡萏香连十顷陂，小姑贪戏采莲迟。#晚来弄水船头湿，更脱红裙裹鸭儿。,N/A,皇甫松，字子奇，自号檀栾子，睦州新安（今浙江淳安）人。他是工部侍郎皇甫湜之子，宰相牛僧孺之外甥。《新唐书&183;艺文志》著录皇甫松《醉乡日月》3卷。其词今存20余首，见于《花间集》、《唐五代词》。事迹见《历代诗馀》。今有王国维辑《檀栾子词》一卷。
梦江南·兰烬落,唐代,皇甫松,兰烬落，屏上暗红蕉。#闲梦江南梅熟日，夜船吹笛雨萧萧。#人语驿边桥。,更深烛尽，烛光暗淡，画屏上的美人蕉模糊不辨。我昏昏欲睡，终于进入了梦乡，梦中是我久别的江南，正是青梅熟时，江南雨季，我独自在一艘船上，手握竹笛，和着船外那萧萧的夜雨尽情的吹奏，时而听见桥上驿亭边人语，操着那久违的乡音，诉说着难忘的故事。,皇甫松，字子奇，自号檀栾子，睦州新安（今浙江淳安）人。他是工部侍郎皇甫湜之子，宰相牛僧孺之外甥。《新唐书&183;艺文志》著录皇甫松《醉乡日月》3卷。其词今存20余首，见于《花间集》、《唐五代词》。事迹见《历代诗馀》。今有王国维辑《檀栾子词》一卷。
望江南·梳洗罢,唐代,温庭筠,梳洗罢，独倚望江楼。#过尽千帆皆不是，斜晖脉脉水悠悠。#肠断白蘋洲。,梳洗完毕，独自一人登上望江楼，倚靠着楼柱凝望着滔滔江面。上千艘船过去了，所盼望的人都没有出现。太阳的余晖脉脉地洒在江面上，江水慢慢地流着，思念的柔肠萦绕在那片白蘋洲上。,温庭筠（约812—866）唐代诗人、词人。本名岐，字飞卿，太原祁（今山西祁县东南）人。富有天才，文思敏捷，每入试，押官韵，八叉手而成八韵，所以也有“温八叉”之称。然恃才不羁，又好讥刺权贵，多犯忌讳，取憎于时，故屡举进士不第，长被贬抑，终生不得志。官终国子助教。精通音律。工诗，与李商隐齐名，时称“温李”。其诗辞藻华丽，秾艳精致，内容多写闺情。其词艺术成就在晚唐诸词人之上，为“花间派”首要词人，对词的发展影响较大。在词史上，与韦庄齐名，并称“温韦”。存词七十余首。后人辑有《温飞卿集》及《金奁集》。
菩萨蛮·小山重叠金明灭,唐代,温庭筠,小山重叠金明灭，鬓云欲度香腮雪。#懒起画蛾眉，弄妆梳洗迟。#照花前后镜，花面交相映。#新帖绣罗襦，双双金鹧鸪。,眉妆漫染，叠盖了部分额黄，鬓边发丝飘过。洁白的香腮似雪，懒得起来，画一画蛾眉，整一整衣裳，梳洗打扮，慢吞吞，意迟迟。照一照新插的花朵，对了前镜，又对后镜，红花与容颜，交相辉映，刚穿上的绫罗裙襦，绣着一双双的金鹧鸪。,温庭筠（约812—866）唐代诗人、词人。本名岐，字飞卿，太原祁（今山西祁县东南）人。富有天才，文思敏捷，每入试，押官韵，八叉手而成八韵，所以也有“温八叉”之称。然恃才不羁，又好讥刺权贵，多犯忌讳，取憎于时，故屡举进士不第，长被贬抑，终生不得志。官终国子助教。精通音律。工诗，与李商隐齐名，时称“温李”。其诗辞藻华丽，秾艳精致，内容多写闺情。其词艺术成就在晚唐诸词人之上，为“花间派”首要词人，对词的发展影响较大。在词史上，与韦庄齐名，并称“温韦”。存词七十余首。后人辑有《温飞卿集》及《金奁集》。
更漏子·柳丝长,唐代,温庭筠,柳丝长，春雨细，花外漏声迢递。#惊塞雁，起城乌，画屏金鹧鸪。#香雾薄，透帘幕，惆怅谢家池阁。#红烛背，绣帘垂，梦长君不知。,柳丝柔长春雨霏霏，花丛外漏声不断传向远方。塞雁向南归去令人惊心，杂乱的城鸟寻觅着栖巢，望着画屏上对对金鹧鸪令人格外伤感。薄薄的香雾透入帘幕之中，美丽的楼阁池榭啊再无人一起观赏。绣帘低垂独自背着垂泪的红色蜡烛，长梦不断远方亲人啊可知道我的衷肠？,温庭筠（约812—866）唐代诗人、词人。本名岐，字飞卿，太原祁（今山西祁县东南）人。富有天才，文思敏捷，每入试，押官韵，八叉手而成八韵，所以也有“温八叉”之称。然恃才不羁，又好讥刺权贵，多犯忌讳，取憎于时，故屡举进士不第，长被贬抑，终生不得志。官终国子助教。精通音律。工诗，与李商隐齐名，时称“温李”。其诗辞藻华丽，秾艳精致，内容多写闺情。其词艺术成就在晚唐诸词人之上，为“花间派”首要词人，对词的发展影响较大。在词史上，与韦庄齐名，并称“温韦”。存词七十余首。后人辑有《温飞卿集》及《金奁集》。
菩萨蛮·红楼别夜堪惆怅,唐代,韦庄,红楼别夜堪惆怅，香灯半卷流苏帐。#残月出门时，美人和泪辞。#琵琶金翠羽，弦上黄莺语。#劝我早还家，绿窗人似花。,当时红楼离别之夜，令人惆怅不已，香灯隐约地映照着半卷的流苏帐。残月将落，天刚破晓时，“我”就要出门远行，美人含着泪珠为“我”送行，真是“寸寸柔肠，盈盈粉泪”的样子。临别时为我弹奏一曲如泣如诉的乐章，那琵琶杆拨上装饰着用金制成的翠羽，雍容华贵；那琵琶弦上弹奏着娇软的莺语，婉转动人。那凄恻的音乐分明是在劝“我”早些儿回家，碧纱窗下有如花美眷在等着他。,韦庄（约836年─910年），字端己，杜陵（今中国陕西省西安市附近）人，诗人韦应物的四代孙，唐朝花间派词人，词风清丽，有《浣花词》流传。曾任前蜀宰相，谥文靖。
菩萨蛮·人人尽说江南好,唐代,韦庄,人人尽说江南好，游人只合江南老。#春水碧于天，画船听雨眠。#垆边人似月，皓腕凝霜雪。#未老莫还乡，还乡须断肠。,人人都说江南好，游人应该在江南待到老去。春天的江水清澈碧绿比天空还青，游人可以在有彩绘的船上听着雨声入眠。江南酒家卖酒的女子长得很美，卖酒撩袖时露出的双臂洁白如雪。年华未衰之时不要回乡，回到家乡后必定悲痛到极点。,韦庄（约836年─910年），字端己，杜陵（今中国陕西省西安市附近）人，诗人韦应物的四代孙，唐朝花间派词人，词风清丽，有《浣花词》流传。曾任前蜀宰相，谥文靖。
菩萨蛮·劝君今夜须沉醉,唐代,韦庄,劝君今夜须沉醉，尊前莫话明朝事。#珍重主人心，酒深情亦深。#须愁春漏短，莫诉金杯满。#遇酒且呵呵，人生能几何。,今天晚上劝您务必要喝个一醉方休，酒桌前千万不要谈论明天的事情。就珍重现在热情的主人的心意吧，因为主人的酒杯是深的，主人的情谊也是深的。我忧愁的是像今晚这般欢饮的春夜太短暂了，我不再推辞说您又将我的酒杯斟得太满。既然有酒可喝再怎么样也得打起精神来，人生能有多长呢？,韦庄（约836年─910年），字端己，杜陵（今中国陕西省西安市附近）人，诗人韦应物的四代孙，唐朝花间派词人，词风清丽，有《浣花词》流传。曾任前蜀宰相，谥文靖。
女冠子·四月十七,唐代,韦庄,四月十七，正是去年今日，别君时。#忍泪佯低面，含羞半敛眉。#不知魂已断，空有梦相随。#除却天边月，没人知。,今天是四月十七，去年这个日子，正是与你离别的时候。忍住泪水假装着低下脸，含羞皱着眉头。自别后我魂销肠断，如今只能在梦里与你相见。我的相思之情，除了天边的月亮，又有谁知道呢？,韦庄（约836年─910年），字端己，杜陵（今中国陕西省西安市附近）人，诗人韦应物的四代孙，唐朝花间派词人，词风清丽，有《浣花词》流传。曾任前蜀宰相，谥文靖。
女冠子·昨夜夜半,唐代,韦庄,昨夜夜半，枕上分明梦见。#语多时。#依旧桃花面，频低柳叶眉。#半羞还半喜，欲去又依依。#觉来知是梦，不胜悲。,昨天深夜里，你在我的梦里翩然出现了。我们说了好多好多的话，发现你依旧还是那么美丽、可爱，像从前一样面若桃花，频频低垂的眼睑，弯弯的柳叶眉。看上去好像又有些羞涩，又有些欢喜。该走时却又频频回首，依依不舍。只到醒来才知道是大梦一场，身边依然空空，自己依然是形单影只的一个人，心中不觉涌起难忍的悲哀。,韦庄（约836年─910年），字端己，杜陵（今中国陕西省西安市附近）人，诗人韦应物的四代孙，唐朝花间派词人，词风清丽，有《浣花词》流传。曾任前蜀宰相，谥文靖。
思帝乡·春日游,唐代,韦庄,春日游，杏花吹满头。#陌上谁家年少足风流？#妾拟将身嫁与一生休。#纵被无情弃，不能羞。,春日踏青郊游，风吹杏花满头。田间路上是谁家少年，青春如花真风流。我想以身相许嫁给他，一生一世就此休。纵使他薄情无义抛弃我，也不后悔也不害羞。,韦庄（约836年─910年），字端己，杜陵（今中国陕西省西安市附近）人，诗人韦应物的四代孙，唐朝花间派词人，词风清丽，有《浣花词》流传。曾任前蜀宰相，谥文靖。
浣溪沙·红蓼渡头秋正雨,唐代,薛昭蕴,红蓼渡头秋正雨，印沙鸥迹自成行，整鬟飘袖野风香。#不语含嚬深浦里，几回愁煞棹船郎，燕归帆尽水茫茫。,N/A,薛昭蕴，字澄州，河中宝鼎（今山西荣河县）人。王衍时，官至侍郎。擅诗词，才华出众。《北梦琐言》：薛澄州昭蕴即保逊之子也。恃才傲物，亦有父风。每入朝省，弄笏而行，旁若无人。好唱《浣溪沙》词。
忆江南·衔泥燕,唐代,牛峤,衔泥燕，飞到画堂前。#占得杏梁安稳处，体轻唯有主人怜，堪羡好因缘。,衔着泥土的燕子，飞到装饰华丽的大堂前，占据着梁间安稳的地方，体态轻盈只有主人伶爱，好烟缘可堪羡慕。,牛峤，字松卿（约公元890年前后在世），一字延峰，陇西人。生卒年均不详，约唐昭宗大顺初前后在世。乾符五年（公元878年）进士及第。历官拾遗，补尚书郎，后人又称“牛给事”。以词著名，词格类温庭筠。原有歌诗集三卷，今存词三十三首，（见《花间集》）诗六首。
生查子·新月曲如眉,五代,牛希济,新月曲如眉，未有团圞意。#红豆不堪看，满眼相思泪。#终日劈桃穰，人在心儿里。#两朵隔墙花，早晚成连理。,新月弯弯如眉毛，没有圆的意思。不忍心看红豆，满眼都是相思泪。整天劈核桃，那人像桃仁嵌在核壳中一样嵌在我心中。两朵隔墙相望的花，早晚会结成连理枝。,五代词人。生卒年不详。陇西（今甘肃）人。词人牛峤之侄。早年即有文名，遇丧乱，流寓于蜀，依峤而居。后为前蜀主王建所赏识，任起居郎。前蜀后主王衍时，累官翰林学士、御史中丞。后唐庄宗同光三年(925)，随前蜀主降于后唐，明宗时拜雍州节度副使。
巫山一段云·古庙依青嶂,唐代,李珣,古庙依青嶂，行宫枕碧流。#水声山色锁妆楼。#往事思悠悠。#云雨朝还暮，烟花春复秋。#啼猿何必近孤舟。#行客自多愁。,神女寺依旧傍着青山，楚王的细腰宫依旧枕着碧绿的江流。潺潺流水和暖暖翠岚环绕着昔日梳妆的楼台，悠悠往事真叫人感慨万千。巫山从早到晚雨迷云轻，春去秋来花开花落，岁月就这般流逝。何必要猿啼声声传向孤舟，远行的旅客自有许多忧愁。,李珣（855？-930？），五代词人。字德润，其祖先为波斯人。居家梓州（四川省三台）。生卒年均不详，约唐昭宗乾宁中前后在世。少有时名，所吟诗句，往往动人。妹舜弦为王衍昭仪，他尝以秀才预宾贡。又通医理，兼卖香药，可见他还不脱波斯人本色。蜀亡，遂亦不仕他姓。珣著有琼瑶集，已佚，今存词五十四首，（见《唐五代词》）多感慨之音。）
南乡子·乘彩舫,唐代,李珣,乘彩舫，过莲塘，棹歌惊起睡鸳鸯。#游女带香偎伴笑，争窈窕，竞折团荷遮晚照。,乘着五彩画舫，经过莲花池塘，船歌悠扬，惊醒安睡的鸳鸯。满身香气的少女只顾依偎着同伴嫣然倩笑，这些少女个个姿态美好，她们在娇笑中折起荷叶遮挡夕阳。,李珣（855？-930？），五代词人。字德润，其祖先为波斯人。居家梓州（四川省三台）。生卒年均不详，约唐昭宗乾宁中前后在世。少有时名，所吟诗句，往往动人。妹舜弦为王衍昭仪，他尝以秀才预宾贡。又通医理，兼卖香药，可见他还不脱波斯人本色。蜀亡，遂亦不仕他姓。珣著有琼瑶集，已佚，今存词五十四首，（见《唐五代词》）多感慨之音。）
