TIMU,CHAODAI,ZUOZHE,NEIRONG,YIWEN,ZZJIANJIE
水龙吟·楚天千里无云,宋代,曾觌,楚天千里无云，露华洗出秋容净。#银蟾台榭，玉壶天地，参差桂影。#鸳瓦寒生，画檐光射，碧梧金井。#听韶华半夜，江梅三弄，风袅袅、良宵永。#携手西园宴罢，下瑶台、醉魂初醒。#吹箫仙子，骖鸾归路，一襟清兴。#鳷鹊楼高，建章门迥，星河耿耿。#看沧江潮上，丹枫叶落，浸关山冷。,N/A,曾觌（音di迪）（1109-1180）字纯甫，汴京（今河南开封）人。绍兴中，为建王内知客。孝宗受禅，以潜邸旧人，授权知阁门事。淳熙初，除开府仪同三司，加少保、醴泉观使。趋奉宫廷，词多应制之作。其词语言婉丽，风格柔媚。代表作为《阮郎归》、《水调歌头》《西江月》《定风波》（长相思》、《采桑子》、《眼儿媚》、《忆秦娥》等，其中以《阮郎归》一词为最著名。
菩萨蛮·书江西造口壁,宋代,辛弃疾,郁孤台下清江水，中间多少行人泪。#西北望长安，可怜无数山。#青山遮不住，毕竟东流去。#江晚正愁余，山深闻鹧鸪。,郁孤台下这赣江的水，水中有多少行人的眼泪。我举头眺望西北的长安，可惜只看到无数青山。但青山怎能把江水挡住？江水毕竟还会向东流去。夕阳西下我正满怀愁绪，听到深山里传来鹧鸪的鸣叫声。,辛弃疾（1140－1207），南宋词人。原字坦夫，改字幼安，别号稼轩，汉族，历城（今山东济南）人。出生时，中原已为金兵所占。21岁参加抗金义军，不久归南宋。历任湖北、江西、湖南、福建、浙东安抚使等职。一生力主抗金。曾上《美芹十论》与《九议》，条陈战守之策。其词抒写力图恢复国家统一的爱国热情，倾诉壮志难酬的悲愤，对当时执政者的屈辱求和颇多谴责；也有不少吟咏祖国河山的作品。题材广阔又善化用前人典故入词，风格沉雄豪迈又不乏细腻柔媚之处。由于辛弃疾的抗金主张与当政的主和派政见不合，后被弹劾落职，退隐江西带湖。
青玉案·元夕,宋代,辛弃疾,东风夜放花千树。#更吹落、星如雨。#宝马雕车香满路。#凤箫声动，玉壶光转，一夜鱼龙舞。#蛾儿雪柳黄金缕。#笑语盈盈暗香去。#众里寻他千百度。#蓦然回首，那人却在，灯火阑珊处。,像东风吹散千树繁花一样，又吹得烟火纷纷，乱落如雨。豪华的马车满路芳香。悠扬的凤箫声四处回荡，玉壶般的明月渐渐西斜，一夜鱼龙灯飞舞笑语喧哗。美人头上都戴着亮丽的饰物，笑语盈盈地随人群走过，身上香气飘洒。我在人群中寻找她千百回，猛然一回头，不经意间却在灯火零落之处发现了她。,辛弃疾（1140－1207），南宋词人。原字坦夫，改字幼安，别号稼轩，汉族，历城（今山东济南）人。出生时，中原已为金兵所占。21岁参加抗金义军，不久归南宋。历任湖北、江西、湖南、福建、浙东安抚使等职。一生力主抗金。曾上《美芹十论》与《九议》，条陈战守之策。其词抒写力图恢复国家统一的爱国热情，倾诉壮志难酬的悲愤，对当时执政者的屈辱求和颇多谴责；也有不少吟咏祖国河山的作品。题材广阔又善化用前人典故入词，风格沉雄豪迈又不乏细腻柔媚之处。由于辛弃疾的抗金主张与当政的主和派政见不合，后被弹劾落职，退隐江西带湖。
清平乐·村居,宋代,辛弃疾,茅檐低小，溪上青青草。#醉里吴音相媚好，白发谁家翁媪？#大儿锄豆溪东，中儿正织鸡笼。#最喜小儿亡赖，溪头卧剥莲蓬。,草屋的茅檐又低又小，溪边长满了碧绿的小草。含有醉意的吴地方言，听起来温柔又美好，那满头白发的老人是谁家的呀？大儿子在溪东边的豆田锄草，二儿子正忙于编织鸡笼。最令人喜爱的是小儿子，他正横卧在溪头草丛，剥着刚摘下的莲蓬。,辛弃疾（1140－1207），南宋词人。原字坦夫，改字幼安，别号稼轩，汉族，历城（今山东济南）人。出生时，中原已为金兵所占。21岁参加抗金义军，不久归南宋。历任湖北、江西、湖南、福建、浙东安抚使等职。一生力主抗金。曾上《美芹十论》与《九议》，条陈战守之策。其词抒写力图恢复国家统一的爱国热情，倾诉壮志难酬的悲愤，对当时执政者的屈辱求和颇多谴责；也有不少吟咏祖国河山的作品。题材广阔又善化用前人典故入词，风格沉雄豪迈又不乏细腻柔媚之处。由于辛弃疾的抗金主张与当政的主和派政见不合，后被弹劾落职，退隐江西带湖。
清平乐·独宿博山王氏庵,宋代,辛弃疾,绕床饥鼠，蝙蝠翻灯舞。#屋上松风吹急雨，破纸窗间自语。#平生塞北江南，归来华发苍颜。#布被秋宵梦觉，眼前万里江山。,饥饿的老鼠绕着床窜来窜去，蝙蝠围着昏黑的油灯上下翻舞。狂风夹带着松涛，犹如汹涌波涛般放声呼啸；大雨瓢泼而下，急促地敲打着屋顶；糊窗纸被风撕裂，发出呼啦啦的声音，仿佛在自言自语。从塞北辗转江南，如今归隐山林，已是容颜苍老，满头白发。一阵凄冷的秋风吹透了单薄的布被，突然惊醒，眼前依稀还是梦中的万里江山。,辛弃疾（1140－1207），南宋词人。原字坦夫，改字幼安，别号稼轩，汉族，历城（今山东济南）人。出生时，中原已为金兵所占。21岁参加抗金义军，不久归南宋。历任湖北、江西、湖南、福建、浙东安抚使等职。一生力主抗金。曾上《美芹十论》与《九议》，条陈战守之策。其词抒写力图恢复国家统一的爱国热情，倾诉壮志难酬的悲愤，对当时执政者的屈辱求和颇多谴责；也有不少吟咏祖国河山的作品。题材广阔又善化用前人典故入词，风格沉雄豪迈又不乏细腻柔媚之处。由于辛弃疾的抗金主张与当政的主和派政见不合，后被弹劾落职，退隐江西带湖。
水龙吟·过南剑双溪楼,宋代,辛弃疾,举头西北浮云，倚天万里须长剑。#人言此地，夜深长见，斗牛光焰。#我觉山高，潭空水冷，月明星淡。#待燃犀下看，凭栏却怕，风雷怒，鱼龙惨。#峡束苍江对起，过危楼，欲飞还敛。#元龙老矣！#不妨高卧，冰壶凉簟。#千古兴亡，百年悲笑，一时登览。#问何人又卸，片帆沙岸，系斜阳缆？,抬头观看西北方向的浮云，驾驭万里长空需要长剑，人们说这个地方，深夜的时候，常常能看见斗牛星宿之间的光芒。我觉得山高，水潭的水冰冷，月亮明亮星光惨淡，待点燃犀牛角下到水中看看，刚靠近栏杆处却害怕，风雷震怒，鱼龙凶残。两边高山约束着东溪和西溪冲过来激起很高的浪花，过高楼，想飞去但还是收敛作罢，我有心像陈元龙那样但是身体精神都已老了，不妨高卧家园，凉爽的酒，凉爽的席子，一时登上双溪楼就想到了千古兴亡的事情，想到我自己的一生不过百年的悲欢离合，嬉笑怒骂。是什么人又一次卸下了张开的白帆，在斜阳夕照中抛锚系缆？,辛弃疾（1140－1207），南宋词人。原字坦夫，改字幼安，别号稼轩，汉族，历城（今山东济南）人。出生时，中原已为金兵所占。21岁参加抗金义军，不久归南宋。历任湖北、江西、湖南、福建、浙东安抚使等职。一生力主抗金。曾上《美芹十论》与《九议》，条陈战守之策。其词抒写力图恢复国家统一的爱国热情，倾诉壮志难酬的悲愤，对当时执政者的屈辱求和颇多谴责；也有不少吟咏祖国河山的作品。题材广阔又善化用前人典故入词，风格沉雄豪迈又不乏细腻柔媚之处。由于辛弃疾的抗金主张与当政的主和派政见不合，后被弹劾落职，退隐江西带湖。
西江月·夜行黄沙道中,宋代,辛弃疾,明月别枝惊鹊，清风半夜鸣蝉。#稻花香里说丰年，听取蛙声一片。#七八个星天外，两三点雨山前。#旧时茅店社林边，路转溪桥忽见。,天边的明月升上了树梢，惊飞了栖息在枝头的喜鹊。清凉的晚风仿佛传来了远处的蝉叫声。在稻花的香气里，人们谈论着丰收的年景，耳边传来一阵阵青蛙的叫声，好像在说着丰收年。天空中轻云漂浮，闪烁的星星时隐时现，山前下起了淅淅沥沥的小雨，从前那熟悉的茅店小屋依然坐落在土地庙附近的树林中，山路一转，曾经那记忆深刻的溪流小桥呈现在他的眼前。,辛弃疾（1140－1207），南宋词人。原字坦夫，改字幼安，别号稼轩，汉族，历城（今山东济南）人。出生时，中原已为金兵所占。21岁参加抗金义军，不久归南宋。历任湖北、江西、湖南、福建、浙东安抚使等职。一生力主抗金。曾上《美芹十论》与《九议》，条陈战守之策。其词抒写力图恢复国家统一的爱国热情，倾诉壮志难酬的悲愤，对当时执政者的屈辱求和颇多谴责；也有不少吟咏祖国河山的作品。题材广阔又善化用前人典故入词，风格沉雄豪迈又不乏细腻柔媚之处。由于辛弃疾的抗金主张与当政的主和派政见不合，后被弹劾落职，退隐江西带湖。
贺新郎·别茂嘉十二弟,宋代,辛弃疾,绿树听鹈鴂，更那堪、鹧鸪声住，杜鹃声切。#啼到春归无寻处，苦恨芳菲都歇。#算未抵、人间离别。#马上琵琶关塞黑，更长门、翠辇辞金阙。#看燕燕，送归妾。#将军百战身名裂。#向河梁、回头万里，故人长绝。#易水萧萧西风冷，满座衣冠似雪。#正壮士、悲歌未彻。#啼鸟还知如许恨，料不啼清泪长啼血。#谁共我，醉明月。,N/A,辛弃疾（1140－1207），南宋词人。原字坦夫，改字幼安，别号稼轩，汉族，历城（今山东济南）人。出生时，中原已为金兵所占。21岁参加抗金义军，不久归南宋。历任湖北、江西、湖南、福建、浙东安抚使等职。一生力主抗金。曾上《美芹十论》与《九议》，条陈战守之策。其词抒写力图恢复国家统一的爱国热情，倾诉壮志难酬的悲愤，对当时执政者的屈辱求和颇多谴责；也有不少吟咏祖国河山的作品。题材广阔又善化用前人典故入词，风格沉雄豪迈又不乏细腻柔媚之处。由于辛弃疾的抗金主张与当政的主和派政见不合，后被弹劾落职，退隐江西带湖。
贺新郎·甚矣吾衰矣,宋代,辛弃疾,甚矣吾衰矣。#怅平生、交游零落，只今馀几！#白发空垂三千丈，一笑人间万事。#问何物、能令公喜？#我见青山多妩媚，料青山见我应如是。#情与貌，略相似。#一尊搔首东窗里。#想渊明《停云》诗就，此时风味。#江左沉酣求名者，岂识浊醪妙理。#回首叫、云飞风起。#不恨古人吾不见，恨古人不见吾狂耳。#知我者，二三子。,我已经很衰老了。平生曾经一同出游的朋友零落四方，如今还剩下多少？真令人惆怅。这么多年只是白白老去而已，功名未竟，对世间万事也慢慢淡泊了。还有什么能真正让我感到快乐？我看那青山潇洒多姿，想必青山看我也是一样。不论情怀还是外貌，都非常相似。把酒一尊，在窗前吟诗，怡然自得。想来当年陶渊明写成《停云》之时也是这样的感觉吧。江南那些醉中都渴求功名的人，又怎能体会到饮酒的真谛？在酒酣之际，回头朗吟长啸，云气会翻飞，狂风会骤起。不恨我不能见到疏狂的前人，只恨前人不能见到我的疏狂而已。了解我的，还是那几个朋友。,辛弃疾（1140－1207），南宋词人。原字坦夫，改字幼安，别号稼轩，汉族，历城（今山东济南）人。出生时，中原已为金兵所占。21岁参加抗金义军，不久归南宋。历任湖北、江西、湖南、福建、浙东安抚使等职。一生力主抗金。曾上《美芹十论》与《九议》，条陈战守之策。其词抒写力图恢复国家统一的爱国热情，倾诉壮志难酬的悲愤，对当时执政者的屈辱求和颇多谴责；也有不少吟咏祖国河山的作品。题材广阔又善化用前人典故入词，风格沉雄豪迈又不乏细腻柔媚之处。由于辛弃疾的抗金主张与当政的主和派政见不合，后被弹劾落职，退隐江西带湖。
丑奴儿·书博山道中壁,宋代,辛弃疾,少年不识愁滋味，爱上层楼。#爱上层楼。#为赋新词强说愁。#而今识尽愁滋味，欲说还休。#欲说还休。#却道天凉好个秋。,人年少时不知道忧愁的滋味，喜欢登高远望。喜欢登高远望，为写一首新词无愁而勉强说愁。现在尝尽了忧愁的滋味，想说却说不出。想说却说不出，却说好一个凉爽的秋天啊！,辛弃疾（1140－1207），南宋词人。原字坦夫，改字幼安，别号稼轩，汉族，历城（今山东济南）人。出生时，中原已为金兵所占。21岁参加抗金义军，不久归南宋。历任湖北、江西、湖南、福建、浙东安抚使等职。一生力主抗金。曾上《美芹十论》与《九议》，条陈战守之策。其词抒写力图恢复国家统一的爱国热情，倾诉壮志难酬的悲愤，对当时执政者的屈辱求和颇多谴责；也有不少吟咏祖国河山的作品。题材广阔又善化用前人典故入词，风格沉雄豪迈又不乏细腻柔媚之处。由于辛弃疾的抗金主张与当政的主和派政见不合，后被弹劾落职，退隐江西带湖。
鹧鸪天·有客慨然谈功名因追念少年时事戏作,宋代,辛弃疾,壮岁旌旗拥万夫，锦襜突骑渡江初。#燕兵夜娖银胡觮，汉箭朝飞金仆姑。#追往事，叹今吾，春风不染白髭须。#却将万字平戎策，换得东家种树书。,我年轻的时候带着一万多的士兵、精锐的骑兵们渡过长江时。金人的士兵晚上在准备着箭袋，而我们汉人的军队一大早向敌人射去名叫金仆姑的箭。追忆着往事，感叹如今的自己，春风也不能把我的白胡子染成黑色了。我看都把那长达几万字能平定金人的策略，拿去跟东边的人家换换种树的书吧。,辛弃疾（1140－1207），南宋词人。原字坦夫，改字幼安，别号稼轩，汉族，历城（今山东济南）人。出生时，中原已为金兵所占。21岁参加抗金义军，不久归南宋。历任湖北、江西、湖南、福建、浙东安抚使等职。一生力主抗金。曾上《美芹十论》与《九议》，条陈战守之策。其词抒写力图恢复国家统一的爱国热情，倾诉壮志难酬的悲愤，对当时执政者的屈辱求和颇多谴责；也有不少吟咏祖国河山的作品。题材广阔又善化用前人典故入词，风格沉雄豪迈又不乏细腻柔媚之处。由于辛弃疾的抗金主张与当政的主和派政见不合，后被弹劾落职，退隐江西带湖。
西江月·遣兴,宋代,辛弃疾,醉里且贪欢笑，要愁那得工夫。#近来始觉古人书，信著全无是处。#昨夜松边醉倒，问松我醉何如。#只疑松动要来扶，以手推松曰去。,喝醉酒我暂且尽情欢笑，哪有工夫整日发愁？近来我才觉得古人的书本，信了它们一点用也没有。昨晚我在松树旁醉倒，问松“我醉到什么程度？”我疑心松枝摆动要把我扶救，连忙用手一推说：“去！”,辛弃疾（1140－1207），南宋词人。原字坦夫，改字幼安，别号稼轩，汉族，历城（今山东济南）人。出生时，中原已为金兵所占。21岁参加抗金义军，不久归南宋。历任湖北、江西、湖南、福建、浙东安抚使等职。一生力主抗金。曾上《美芹十论》与《九议》，条陈战守之策。其词抒写力图恢复国家统一的爱国热情，倾诉壮志难酬的悲愤，对当时执政者的屈辱求和颇多谴责；也有不少吟咏祖国河山的作品。题材广阔又善化用前人典故入词，风格沉雄豪迈又不乏细腻柔媚之处。由于辛弃疾的抗金主张与当政的主和派政见不合，后被弹劾落职，退隐江西带湖。
永遇乐·京口北固亭怀古,宋代,辛弃疾,千古江山，英雄无觅，孙仲谋处。#舞榭歌台，风流总被雨打风吹去。#斜阳草树，寻常巷陌，人道寄奴曾住。#想当年，金戈铁马，气吞万里如虎。#元嘉草草，封狼居胥，赢得仓皇北顾。#四十三年，望中犹记，烽火扬州路。#可堪回首，佛狸祠下，一片神鸦社鼓。#凭谁问，廉颇老矣，尚能饭否？,N/A,辛弃疾（1140－1207），南宋词人。原字坦夫，改字幼安，别号稼轩，汉族，历城（今山东济南）人。出生时，中原已为金兵所占。21岁参加抗金义军，不久归南宋。历任湖北、江西、湖南、福建、浙东安抚使等职。一生力主抗金。曾上《美芹十论》与《九议》，条陈战守之策。其词抒写力图恢复国家统一的爱国热情，倾诉壮志难酬的悲愤，对当时执政者的屈辱求和颇多谴责；也有不少吟咏祖国河山的作品。题材广阔又善化用前人典故入词，风格沉雄豪迈又不乏细腻柔媚之处。由于辛弃疾的抗金主张与当政的主和派政见不合，后被弹劾落职，退隐江西带湖。
南乡子·登京口北固亭有怀,宋代,辛弃疾,何处望神州？#满眼风光北固楼。#千古兴亡多少事？#悠悠。#不尽长江滚滚流。#年少万兜鍪，坐断东南战未休。#天下英雄谁敌手？#曹刘。#生子当如孙仲谋。,什么地方可以看见中原呢？在北固楼上，满眼都是美好的风光。从古到今，有多少国家兴亡大事呢？不知道。往事连绵不断，如同没有尽头的长江水滚滚地奔流不息。当年孙权在青年时代，做了三军统帅。他能占据东南，坚持抗战，没有向敌人低头和屈服过。天下英雄谁是孙权的敌手呢？只有曹操和刘备而已。这样也就难怪曹操说：“要是能有个孙权那样的儿子就好了！”,辛弃疾（1140－1207），南宋词人。原字坦夫，改字幼安，别号稼轩，汉族，历城（今山东济南）人。出生时，中原已为金兵所占。21岁参加抗金义军，不久归南宋。历任湖北、江西、湖南、福建、浙东安抚使等职。一生力主抗金。曾上《美芹十论》与《九议》，条陈战守之策。其词抒写力图恢复国家统一的爱国热情，倾诉壮志难酬的悲愤，对当时执政者的屈辱求和颇多谴责；也有不少吟咏祖国河山的作品。题材广阔又善化用前人典故入词，风格沉雄豪迈又不乏细腻柔媚之处。由于辛弃疾的抗金主张与当政的主和派政见不合，后被弹劾落职，退隐江西带湖。
卜算子·见也如何暮,宋代,石孝友,见也如何暮。#别也如何遽。#别也应难见也难，后会难凭据。#去也如何去。#住也如何住。#住也应难去也难，此际难分付。,相见为何太晚，而离别又为何如此匆匆。是离别难相见也难，再见无确期。离去该怎样离去，留下又该怎样留下。是留下难离去也难，此时怎么办。,石孝友，南宋词人，字次仲，江西南昌人。生卒年不详。宋孝宗乾道二年（1166）进士。填词常用俚俗之语，状写男女情爱。仕途不顺，不羡富贵，隐居于丘壑之间。石孝友著有《金谷遗音》，《直斋书录解题》著录一卷，明《唐宋名贤百家词》本作《金谷词》，不分卷。有明汲古阁《宋六十名家词》本、《四部备要》排印本。《全宋词》据毛□校汲古阁本收录。
水龙吟·春恨,宋代,陈亮,闹花深处层楼，画帘半卷东风软。#春归翠陌，平莎茸嫩，垂杨金浅。#迟日催花，淡云阁雨，轻寒轻暖。#恨芳菲世界，游人未赏，都付与、莺和燕。#寂寞凭高念远。#向南楼、一声归雁。#金钗斗草，青丝勒马，风流云散。#罗绶分香，翠绡对泪，几多幽怨。#正销魂，又是疏烟淡月，子规声断。,盛开的花丛深处，耸立着高楼，东风从半卷的画帘吹入，令人觉得分外柔软。春天已经回来，苍翠镀上阡陌，平莎长得娇嫩，垂杨轻轻地飘荡着金线。春日迟迟地催开百花，云烟淡淡地搁住新雨，刚刚感到微寒，忽又稍微和暖。可恨这繁华似锦的世界，游人还未欣赏，却全都交给了黄莺和飞燕。寂寞时登上高处眺望边远，转向南楼又听一听凄切的归雁。回想拔下金钗挑斗绿草，牵住青丝勒紧征马，别后已象风云飘流分散。只有丝带还飘荡着芳香，翠绿的薄绸还残留着眼泪，有多少的幽恨愁怨？正在为离愁伤感却又是稀薄的烟雾中透出淡淡的明月，远处传来杜鹃悲切的叫声令人肠断。,陈亮（1143—1194）原名汝能，后改名陈亮，字同甫，号龙川，婺州永康（今属浙江）人。婺州以解头荐，因上《中兴五论》，奏入不报。孝宗淳熙五年，诣阙上书论国事。后曾两次被诬入狱。绍熙四年光宗策进士第一，状元。授签书建康府判官公事，未行而卒，谥号文毅。所作政论气势纵横，词作豪放，有《龙川文集》《龙川词》，宋史有传。
唐多令·芦叶满汀洲,宋代,刘过,芦叶满汀洲，寒沙带浅流。#二十年重过南楼。#柳下系船犹未稳，能几日，又中秋。#黄鹤断矶头，故人今在否？#旧江山浑是新愁。#欲买桂花同载酒，终不似，少年游。,N/A,刘过（1154～1206）南宋文学家，字改之，号龙洲道人。吉州太和（今江西泰和县）人，长于庐陵（今江西吉安），去世于江苏昆山，今其墓尚在。四次应举不中，流落江湖间，布衣终身。曾为陆游、辛弃疾所赏，亦与陈亮、岳珂友善。词风与辛弃疾相近，抒发抗金抱负狂逸俊致，与刘克庄、刘辰翁享有“辛派三刘”之誉，又与刘仙伦合称为“庐陵二布衣”。有《龙洲集》、《龙洲词》。
西江月·堂上谋臣尊俎,宋代,刘过,堂上谋臣尊俎，边头将士干戈。#天时地利与人和，“燕可伐欤？#”曰：“可”。#今日楼台鼎鼐，明年带砺山河。#大家齐唱《大风歌》，不日四方来贺。,大堂之上谋臣开宴，边疆将士手持武器。作战的自然气候条件具备，地理环境优越，且众志成城。“可以讨伐燕国了吗？”说：“可以。”今日在楼台之上筹谋国政，明年建立不世之功。大家一起高唱《大风歌》，不需多日四方便来庆贺。,刘过（1154～1206）南宋文学家，字改之，号龙洲道人。吉州太和（今江西泰和县）人，长于庐陵（今江西吉安），去世于江苏昆山，今其墓尚在。四次应举不中，流落江湖间，布衣终身。曾为陆游、辛弃疾所赏，亦与陈亮、岳珂友善。词风与辛弃疾相近，抒发抗金抱负狂逸俊致，与刘克庄、刘辰翁享有“辛派三刘”之誉，又与刘仙伦合称为“庐陵二布衣”。有《龙洲集》、《龙洲词》。
点绛唇·丁未冬过吴松作,宋代,姜夔,燕雁无心，太湖西畔随云去。#数峰清苦。#商略黄昏雨。#第四桥边，拟共天随住。#今何许。#凭阑怀古。#残柳参差舞。,北方的鸿雁悠然自在，从太湖西畔随着白云飘浮。几座孤峰萧瑟愁苦，好像在商量黄昏是否下雨。我真想在第四桥边，跟随天随子一起隐居。可他如今在何处？我独倚栏杆缅怀千古，只见衰柳参差风中飞舞。,姜夔，南宋文学家、音乐家。人品秀拔，体态清莹，气貌若不胜衣，望之若神仙中人。往来鄂、赣、皖、苏、浙间，与诗人词家杨万里、范成大、辛弃疾等交游。庆元中，曾上书乞正太常雅乐，他少年孤贫，屡试不第，终生未仕，一生转徙江湖，靠卖字和朋友接济为生。他多才多艺，精通音律，能自度曲，其词格律严密。其作品素以空灵含蓄著称，有《白石道人歌曲》等。姜夔对诗词、散文、书法、音乐，无不精善，是继苏轼之后又一难得的艺术全才。
